<?xml version="1.0" encoding="UTF-8"?>
<xs:schema xmlns:xs="http://www.w3.org/2001/XMLSchema">
    <xs:element name="transporte" type="tTransporte"/>
    <xs:complexType name="tTransporte">
        <xs:choice minOccurs="0" maxOccurs="unbounded">
            <xs:element name="coche" type="xs:string"/>
            <xs:element name="tren" type="xs:string"/>
            <xs:element name="avion" type="xs:string"/>
        </xs:choice>
    </xs:complexType>
</xs:schema>